{
  "schema_version": "1.0",
  "generated_by": "scripts/finalize_batch.py",
  "batch": 100,
  "commit": "2b79f7516a5b81fd0d3ad073476e1c32ad731aa2",
  "mode": "pre-commit",
  "changed_files": [
    "docs/ARCHITECTURE.md",
    "docs/PROGRESS.md",
    "docs/PROJECT_REQUIREMENTS.md",
    "scripts/finalize_batch.py",
    "scripts/verify_batch_completion.py",
    "tests/test_finalize_batch.py",
    "tests/test_verify_batch_completion.py",
    "docs/verification/batches/batch-100-evidence.json",
    "docs/verification/batches/batch-100-manifest.json",
    "docs/verification/batches/batch-100-review.md",
    "docs/verification/coderabbit/batch-100-review.jsonl"
  ],
  "required_artifacts": [
    "scripts/finalize_batch.py",
    "scripts/verify_batch_completion.py",
    "tests/test_finalize_batch.py",
    "tests/test_verify_batch_completion.py",
    "docs/PROJECT_REQUIREMENTS.md",
    "docs/ARCHITECTURE.md",
    "docs/PROGRESS.md",
    "docs/verification/batches/batch-100-manifest.json",
    "docs/verification/batches/batch-100-review.md",
    "docs/verification/batches/batch-100-evidence.json"
  ],
  "review_file": "docs/verification/batches/batch-100-review.md",
  "commands": [
    {
      "name": "批次门禁回归测试",
      "command": ".\\.runtime\\python\\python.exe -m unittest tests.test_verify_batch_completion tests.test_finalize_batch -v",
      "exit_code": 0,
      "summary": "test_finalize_batch_script_runs_directly (tests.test_finalize_batch.FinalizeBatchTests.test_finalize_batch_script_runs_directly) | 脚本必须支持 python scripts/finalize_batch.py 直接执行。 ... ok | ---------------------------------------------------------------------- | Ran 34 tests in 1.457s | OK"
    },
    {
      "name": "门禁脚本编译检查",
      "command": ".\\.runtime\\python\\python.exe -m compileall -q scripts tests",
      "exit_code": 0,
      "summary": "无输出"
    },
    {
      "name": "空白检查",
      "command": "git diff --check",
      "exit_code": 0,
      "summary": "warning: in the working copy of 'docs/PROJECT_REQUIREMENTS.md', LF will be replaced by CRLF the next time Git touches it | warning: in the working copy of 'scripts/finalize_batch.py', LF will be replaced by CRLF the next time Git touches it | warning: in the working copy of 'scripts/verify_batch_completion.py', LF will be replaced by CRLF the next time Git touches it | warning: in the working copy of 'tests/test_finalize_batch.py', LF will be replaced by CRLF the next time Git touches it | warni"
    }
  ],
  "coderabbit": {
    "ran": true,
    "exit_code": 0,
    "unhandled_issues": 0,
    "summary": "CodeRabbit 原始产物解析完成：findings=0, fixed=0",
    "artifact": "docs/verification/coderabbit/batch-100-review.jsonl"
  },
  "external_review_required": true,
  "progress_updated": true,
  "independent_commit": true,
  "blocking_gaps": []
}
